{
  "SchemaVersion": "0.1.0",
  "Project": {
    "Name": "Kunming Building",
    "Code": "KM-B-001"
  },
  "Site": {
    "SiteClass": "III",
    "Address": "Kunming, Yunnan",
    "Latitude": 24.88,
    "Longitude": 102.83
  },
  "Structure": {
    "StructureType": "FrameShearWall",
    "Stories": 14,
    "Height": 47.4,
    "IsolationSystem": true,
    "IsolationType": "LeadRubberBearing",
    "SeismicDesignIntensity": 8
  },
  "Instruments": [
    {
      "InstrumentID": "INS-001",
      "InstrumentType": "DataAcquisitionSystem"
    }
  ],
  "Monitoring": {
    "Sensors": [
      {
        "SensorID": "S001",
        "InstrumentID": "INS-001",
        "Floor": "1",
        "Direction": "X"
      },
      {
        "SensorID": "S002",
        "InstrumentID": "INS-001",
        "Floor": "8",
        "Direction": "Y"
      }
    ],
    "Channels": [
      {
        "ChannelID": "CH-001",
        "SensorID": "S001",
        "ChannelNumber": 1
      },
      {
        "ChannelID": "CH-002",
        "SensorID": "S002",
        "ChannelNumber": 2
      }
    ]
  }
}
